1741375617.866051 IP 10.0.0.3.42624 > 10.0.1.3.9090: Flags [S], seq 3807052484, win 64240, options [mss 1460,sackOK,TS val 4233006441 ecr 0,nop,wscale 7], length 0
1741375617.910563 IP 10.0.1.3.9090 > 10.0.0.3.42624: Flags [S.], seq 4019792362, ack 3807052485, win 65160, options [mss 1460,sackOK,TS val 2446985084 ecr 4233006441,nop,wscale 7], length 0
1741375617.910599 IP 10.0.0.3.42624 > 10.0.1.3.9090: Flags [.], ack 1, win 502, options [nop,nop,TS val 4233006485 ecr 2446985084], length 0
1741375617.986132 IP 10.0.0.3.42624 > 10.0.1.3.9090: Flags [.], seq 1:1449, ack 1, win 502, options [nop,nop,TS val 4233006561 ecr 2446985084], length 1448
1741375617.986636 IP 10.0.0.3.42624 > 10.0.1.3.9090: Flags [.], seq 2897:4345, ack 1, win 502, options [nop,nop,TS val 4233006561 ecr 2446985084], length 1448
1741375617.987012 IP 10.0.0.3.42624 > 10.0.1.3.9090: Flags [.], seq 5793:7241, ack 1, win 502, options [nop,nop,TS val 4233006561 ecr 2446985084], length 1448
1741375617.987495 IP 10.0.0.3.42624 > 10.0.1.3.9090: Flags [.], seq 8689:10137, ack 1, win 502, options [nop,nop,TS val 4233006561 ecr 2446985084], length 1448
1741375617.987825 IP 10.0.0.3.42624 > 10.0.1.3.9090: Flags [.], seq 11585:13033, ack 1, win 502, options [nop,nop,TS val 4233006561 ecr 2446985084], length 1448
1741375618.028976 IP 10.0.1.3.9090 > 10.0.0.3.42624: Flags [.], ack 2897, win 546, options [nop,nop,TS val 2446985202 ecr 4233006561], length 0
1741375618.029015 IP 10.0.0.3.42624 > 10.0.1.3.9090: Flags [.], seq 14481:15929, ack 1, win 502, options [nop,nop,TS val 4233006604 ecr 2446985202], length 1448
1741375618.029091 IP 10.0.1.3.9090 > 10.0.0.3.42624: Flags [.], ack 5793, win 592, options [nop,nop,TS val 2446985202 ecr 4233006561], length 0
1741375618.029094 IP 10.0.1.3.9090 > 10.0.0.3.42624: Flags [.], ack 7241, win 614, options [nop,nop,TS val 2446985202 ecr 4233006561], length 0
1741375618.029156 IP 10.0.0.3.42624 > 10.0.1.3.9090: Flags [.], seq 17377:18825, ack 1, win 502, options [nop,nop,TS val 4233006604 ecr 2446985202], length 1448
1741375618.029264 IP 10.0.1.3.9090 > 10.0.0.3.42624: Flags [.], ack 8689, win 637, options [nop,nop,TS val 2446985203 ecr 4233006561], length 0
1741375618.029270 IP 10.0.1.3.9090 > 10.0.0.3.42624: Flags [.], ack 11585, win 682, options [nop,nop,TS val 2446985203 ecr 4233006561], length 0
1741375618.029271 IP 10.0.1.3.9090 > 10.0.0.3.42624: Flags [.], ack 14481, win 670, options [nop,nop,TS val 2446985203 ecr 4233006561], length 0
1741375618.029335 IP 10.0.0.3.42624 > 10.0.1.3.9090: Flags [.], seq 20273:21721, ack 1, win 502, options [nop,nop,TS val 4233006604 ecr 2446985203], length 1448
1741375618.029451 IP 10.0.0.3.42624 > 10.0.1.3.9090: Flags [.], seq 23169:24617, ack 1, win 502, options [nop,nop,TS val 4233006604 ecr 2446985203], length 1448
1741375618.029605 IP 10.0.0.3.42624 > 10.0.1.3.9090: Flags [.], seq 26065:27513, ack 1, win 502, options [nop,nop,TS val 4233006604 ecr 2446985203], length 1448
1741375618.060758 IP 10.0.0.3.42624 > 10.0.1.3.9090: Flags [.], seq 30001:31449, ack 1, win 502, options [nop,nop,TS val 4233006635 ecr 2446985203], length 1448
1741375618.060987 IP 10.0.0.3.42624 > 10.0.1.3.9090: Flags [.], seq 32897:34345, ack 1, win 502, options [nop,nop,TS val 4233006635 ecr 2446985203], length 1448
1741375618.061099 IP 10.0.0.3.42624 > 10.0.1.3.9090: Flags [.], seq 35793:37241, ack 1, win 502, options [nop,nop,TS val 4233006635 ecr 2446985203], length 1448
1741375618.061201 IP 10.0.0.3.42624 > 10.0.1.3.9090: Flags [.], seq 38689:40137, ack 1, win 502, options [nop,nop,TS val 4233006635 ecr 2446985203], length 1448
1741375618.071653 IP 10.0.1.3.9090 > 10.0.0.3.42624: Flags [.], ack 17377, win 702, options [nop,nop,TS val 2446985245 ecr 4233006604], length 0
1741375618.071674 IP 10.0.0.3.42624 > 10.0.1.3.9090: Flags [.], seq 41585:43033, ack 1, win 502, options [nop,nop,TS val 4233006646 ecr 2446985245], length 1448
1741375618.071763 IP 10.0.1.3.9090 > 10.0.0.3.42624: Flags [.], ack 20273, win 681, options [nop,nop,TS val 2446985245 ecr 4233006604], length 0
1741375618.071766 IP 10.0.1.3.9090 > 10.0.0.3.42624: Flags [.], ack 26065, win 792, options [nop,nop,TS val 2446985245 ecr 4233006604], length 0
1741375618.071767 IP 10.0.1.3.9090 > 10.0.0.3.42624: Flags [.], ack 30001, win 819, options [nop,nop,TS val 2446985245 ecr 4233006604], length 0
1741375618.071839 IP 10.0.0.3.42624 > 10.0.1.3.9090: Flags [.], seq 44481:45929, ack 1, win 502, options [nop,nop,TS val 4233006647 ecr 2446985245], length 1448
1741375618.071947 IP 10.0.0.3.42624 > 10.0.1.3.9090: Flags [.], seq 47377:48825, ack 1, win 502, options [nop,nop,TS val 4233006647 ecr 2446985245], length 1448
1741375618.072068 IP 10.0.0.3.42624 > 10.0.1.3.9090: Flags [.], seq 50273:51721, ack 1, win 502, options [nop,nop,TS val 4233006647 ecr 2446985245], length 1448
1741375618.072182 IP 10.0.0.3.42624 > 10.0.1.3.9090: Flags [.], seq 53169:54617, ack 1, win 502, options [nop,nop,TS val 4233006647 ecr 2446985245], length 1448
1741375618.072287 IP 10.0.0.3.42624 > 10.0.1.3.9090: Flags [.], seq 56065:57513, ack 1, win 502, options [nop,nop,TS val 4233006647 ecr 2446985245], length 1448
1741375618.103397 IP 10.0.1.3.9090 > 10.0.0.3.42624: Flags [.], ack 32897, win 862, options [nop,nop,TS val 2446985277 ecr 4233006635], length 0
1741375618.103424 IP 10.0.1.3.9090 > 10.0.0.3.42624: Flags [.], ack 35793, win 841, options [nop,nop,TS val 2446985277 ecr 4233006635], length 0
1741375618.103426 IP 10.0.1.3.9090 > 10.0.0.3.42624: Flags [.], ack 38689, win 820, options [nop,nop,TS val 2446985277 ecr 4233006635], length 0
1741375618.103428 IP 10.0.1.3.9090 > 10.0.0.3.42624: Flags [.], ack 41585, win 799, options [nop,nop,TS val 2446985277 ecr 4233006635], length 0
1741375618.114037 IP 10.0.1.3.9090 > 10.0.0.3.42624: Flags [.], ack 44481, win 862, options [nop,nop,TS val 2446985287 ecr 4233006646], length 0
1741375618.114055 IP 10.0.1.3.9090 > 10.0.0.3.42624: Flags [.], ack 47377, win 841, options [nop,nop,TS val 2446985287 ecr 4233006647], length 0
1741375618.114056 IP 10.0.1.3.9090 > 10.0.0.3.42624: Flags [.], ack 50273, win 820, options [nop,nop,TS val 2446985287 ecr 4233006647], length 0
1741375618.114058 IP 10.0.1.3.9090 > 10.0.0.3.42624: Flags [.], ack 53169, win 862, options [nop,nop,TS val 2446985287 ecr 4233006647], length 0
1741375618.114059 IP 10.0.1.3.9090 > 10.0.0.3.42624: Flags [.], ack 57513, win 852, options [nop,nop,TS val 2446985287 ecr 4233006647], length 0
1741375618.114713 IP 10.0.1.3.9090 > 10.0.0.3.42624: Flags [.], ack 58961, win 873, options [nop,nop,TS val 2446985288 ecr 4233006647], length 0
1741375618.114721 IP 10.0.1.3.9090 > 10.0.0.3.42624: Flags [.], ack 60001, win 865, options [nop,nop,TS val 2446985288 ecr 4233006647], length 0
1741375618.133568 IP 10.0.0.3.42624 > 10.0.1.3.9090: Flags [.], seq 60001:61449, ack 1, win 502, options [nop,nop,TS val 4233006708 ecr 2446985288], length 1448
1741375618.133758 IP 10.0.0.3.42624 > 10.0.1.3.9090: Flags [.], seq 62897:64345, ack 1, win 502, options [nop,nop,TS val 4233006708 ecr 2446985288], length 1448
1741375618.133890 IP 10.0.0.3.42624 > 10.0.1.3.9090: Flags [.], seq 65793:67241, ack 1, win 502, options [nop,nop,TS val 4233006708 ecr 2446985288], length 1448
1741375618.134005 IP 10.0.0.3.42624 > 10.0.1.3.9090: Flags [.], seq 68689:70137, ack 1, win 502, options [nop,nop,TS val 4233006708 ecr 2446985288], length 1448
1741375618.134112 IP 10.0.0.3.42624 > 10.0.1.3.9090: Flags [.], seq 71585:73033, ack 1, win 502, options [nop,nop,TS val 4233006708 ecr 2446985288], length 1448
1741375618.134253 IP 10.0.0.3.42624 > 10.0.1.3.9090: Flags [.], seq 74481:75929, ack 1, win 502, options [nop,nop,TS val 4233006708 ecr 2446985288], length 1448
1741375618.134360 IP 10.0.0.3.42624 > 10.0.1.3.9090: Flags [.], seq 77377:78825, ack 1, win 502, options [nop,nop,TS val 4233006708 ecr 2446985288], length 1448
1741375618.134474 IP 10.0.0.3.42624 > 10.0.1.3.9090: Flags [.], seq 80273:81721, ack 1, win 502, options [nop,nop,TS val 4233006708 ecr 2446985288], length 1448
1741375618.134581 IP 10.0.0.3.42624 > 10.0.1.3.9090: Flags [.], seq 83169:84617, ack 1, win 502, options [nop,nop,TS val 4233006708 ecr 2446985288], length 1448
1741375618.134690 IP 10.0.0.3.42624 > 10.0.1.3.9090: Flags [.], seq 86065:87513, ack 1, win 502, options [nop,nop,TS val 4233006708 ecr 2446985288], length 1448
1741375618.176294 IP 10.0.1.3.9090 > 10.0.0.3.42624: Flags [.], ack 62897, win 862, options [nop,nop,TS val 2446985350 ecr 4233006708], length 0
1741375618.176442 IP 10.0.1.3.9090 > 10.0.0.3.42624: Flags [.], ack 71585, win 1009, options [nop,nop,TS val 2446985350 ecr 4233006708], length 0
1741375618.176451 IP 10.0.1.3.9090 > 10.0.0.3.42624: Flags [.], ack 74481, win 1054, options [nop,nop,TS val 2446985350 ecr 4233006708], length 0
1741375618.176452 IP 10.0.1.3.9090 > 10.0.0.3.42624: Flags [.], ack 77377, win 1099, options [nop,nop,TS val 2446985350 ecr 4233006708], length 0
1741375618.176454 IP 10.0.1.3.9090 > 10.0.0.3.42624: Flags [.], ack 80273, win 1144, options [nop,nop,TS val 2446985350 ecr 4233006708], length 0
1741375618.176455 IP 10.0.1.3.9090 > 10.0.0.3.42624: Flags [.], ack 83169, win 1190, options [nop,nop,TS val 2446985350 ecr 4233006708], length 0
1741375618.176456 IP 10.0.1.3.9090 > 10.0.0.3.42624: Flags [.], ack 86065, win 1235, options [nop,nop,TS val 2446985350 ecr 4233006708], length 0
1741375618.176456 IP 10.0.1.3.9090 > 10.0.0.3.42624: Flags [.], ack 88961, win 1280, options [nop,nop,TS val 2446985350 ecr 4233006708], length 0
1741375618.177037 IP 10.0.1.3.9090 > 10.0.0.3.42624: Flags [.], ack 90001, win 1303, options [nop,nop,TS val 2446985350 ecr 4233006708], length 0
1741375618.207220 IP 10.0.0.3.42624 > 10.0.1.3.9090: Flags [.], seq 90001:91449, ack 1, win 502, options [nop,nop,TS val 4233006782 ecr 2446985350], length 1448
1741375618.207653 IP 10.0.0.3.42624 > 10.0.1.3.9090: Flags [.], seq 92897:94345, ack 1, win 502, options [nop,nop,TS val 4233006782 ecr 2446985350], length 1448
1741375618.207852 IP 10.0.0.3.42624 > 10.0.1.3.9090: Flags [.], seq 95793:97241, ack 1, win 502, options [nop,nop,TS val 4233006782 ecr 2446985350], length 1448
1741375618.208034 IP 10.0.0.3.42624 > 10.0.1.3.9090: Flags [.], seq 98689:100137, ack 1, win 502, options [nop,nop,TS val 4233006782 ecr 2446985350], length 1448
1741375618.208210 IP 10.0.0.3.42624 > 10.0.1.3.9090: Flags [.], seq 101585:103033, ack 1, win 502, options [nop,nop,TS val 4233006782 ecr 2446985350], length 1448
1741375618.208377 IP 10.0.0.3.42624 > 10.0.1.3.9090: Flags [.], seq 104481:105929, ack 1, win 502, options [nop,nop,TS val 4233006782 ecr 2446985350], length 1448
1741375618.208574 IP 10.0.0.3.42624 > 10.0.1.3.9090: Flags [.], seq 107377:108825, ack 1, win 502, options [nop,nop,TS val 4233006782 ecr 2446985350], length 1448
1741375618.208747 IP 10.0.0.3.42624 > 10.0.1.3.9090: Flags [.], seq 110273:111721, ack 1, win 502, options [nop,nop,TS val 4233006782 ecr 2446985350], length 1448
1741375618.208918 IP 10.0.0.3.42624 > 10.0.1.3.9090: Flags [.], seq 113169:114617, ack 1, win 502, options [nop,nop,TS val 4233006782 ecr 2446985350], length 1448
1741375618.209079 IP 10.0.0.3.42624 > 10.0.1.3.9090: Flags [.], seq 116065:117513, ack 1, win 502, options [nop,nop,TS val 4233006782 ecr 2446985350], length 1448
1741375618.249171 IP 10.0.1.3.9090 > 10.0.0.3.42624: Flags [.], ack 92897, win 1348, options [nop,nop,TS val 2446985423 ecr 4233006782], length 0
1741375618.249190 IP 10.0.1.3.9090 > 10.0.0.3.42624: Flags [.], ack 94345, win 1371, options [nop,nop,TS val 2446985423 ecr 4233006782], length 0
1741375618.249192 IP 10.0.1.3.9090 > 10.0.0.3.42624: Flags [.], ack 95793, win 1393, options [nop,nop,TS val 2446985423 ecr 4233006782], length 0
1741375618.249193 IP 10.0.1.3.9090 > 10.0.0.3.42624: Flags [.], ack 98689, win 1439, options [nop,nop,TS val 2446985423 ecr 4233006782], length 0
1741375618.249194 IP 10.0.1.3.9090 > 10.0.0.3.42624: Flags [.], ack 101585, win 1484, options [nop,nop,TS val 2446985423 ecr 4233006782], length 0
1741375618.249194 IP 10.0.1.3.9090 > 10.0.0.3.42624: Flags [.], ack 103033, win 1506, options [nop,nop,TS val 2446985423 ecr 4233006782], length 0
1741375618.249582 IP 10.0.1.3.9090 > 10.0.0.3.42624: Flags [.], ack 104481, win 1529, options [nop,nop,TS val 2446985423 ecr 4233006782], length 0
1741375618.249587 IP 10.0.1.3.9090 > 10.0.0.3.42624: Flags [.], ack 107377, win 1574, options [nop,nop,TS val 2446985423 ecr 4233006782], length 0
1741375618.249589 IP 10.0.1.3.9090 > 10.0.0.3.42624: Flags [.], ack 110273, win 1620, options [nop,nop,TS val 2446985424 ecr 4233006782], length 0
1741375618.249590 IP 10.0.1.3.9090 > 10.0.0.3.42624: Flags [.], ack 113169, win 1665, options [nop,nop,TS val 2446985424 ecr 4233006782], length 0
1741375618.249732 IP 10.0.1.3.9090 > 10.0.0.3.42624: Flags [.], ack 116065, win 1710, options [nop,nop,TS val 2446985424 ecr 4233006782], length 0
1741375618.249941 IP 10.0.1.3.9090 > 10.0.0.3.42624: Flags [.], ack 118961, win 1755, options [nop,nop,TS val 2446985424 ecr 4233006782], length 0
1741375618.249944 IP 10.0.1.3.9090 > 10.0.0.3.42624: Flags [.], ack 120001, win 1778, options [nop,nop,TS val 2446985424 ecr 4233006782], length 0
1741375618.281610 IP 10.0.0.3.42624 > 10.0.1.3.9090: Flags [.], seq 120001:121449, ack 1, win 502, options [nop,nop,TS val 4233006856 ecr 2446985424], length 1448
1741375618.281856 IP 10.0.0.3.42624 > 10.0.1.3.9090: Flags [.], seq 122897:124345, ack 1, win 502, options [nop,nop,TS val 4233006856 ecr 2446985424], length 1448
1741375618.281968 IP 10.0.0.3.42624 > 10.0.1.3.9090: Flags [.], seq 125793:127241, ack 1, win 502, options [nop,nop,TS val 4233006856 ecr 2446985424], length 1448
1741375618.282074 IP 10.0.0.3.42624 > 10.0.1.3.9090: Flags [.], seq 128689:130137, ack 1, win 502, options [nop,nop,TS val 4233006856 ecr 2446985424], length 1448
1741375618.282180 IP 10.0.0.3.42624 > 10.0.1.3.9090: Flags [.], seq 131585:133033, ack 1, win 502, options [nop,nop,TS val 4233006856 ecr 2446985424], length 1448
1741375618.282283 IP 10.0.0.3.42624 > 10.0.1.3.9090: Flags [.], seq 134481:135929, ack 1, win 502, options [nop,nop,TS val 4233006856 ecr 2446985424], length 1448
1741375618.282385 IP 10.0.0.3.42624 > 10.0.1.3.9090: Flags [.], seq 137377:138825, ack 1, win 502, options [nop,nop,TS val 4233006856 ecr 2446985424], length 1448
1741375618.282508 IP 10.0.0.3.42624 > 10.0.1.3.9090: Flags [.], seq 140273:141721, ack 1, win 502, options [nop,nop,TS val 4233006856 ecr 2446985424], length 1448
1741375618.282609 IP 10.0.0.3.42624 > 10.0.1.3.9090: Flags [.], seq 143169:144617, ack 1, win 502, options [nop,nop,TS val 4233006856 ecr 2446985424], length 1448
1741375618.282708 IP 10.0.0.3.42624 > 10.0.1.3.9090: Flags [.], seq 146065:147513, ack 1, win 502, options [nop,nop,TS val 4233006856 ecr 2446985424], length 1448
1741375618.323276 IP 10.0.1.3.9090 > 10.0.0.3.42624: Flags [.], ack 122897, win 1823, options [nop,nop,TS val 2446985497 ecr 4233006856], length 0
1741375618.323305 IP 10.0.1.3.9090 > 10.0.0.3.42624: Flags [.], ack 125793, win 1868, options [nop,nop,TS val 2446985497 ecr 4233006856], length 0
1741375618.323307 IP 10.0.1.3.9090 > 10.0.0.3.42624: Flags [.], ack 128689, win 1914, options [nop,nop,TS val 2446985497 ecr 4233006856], length 0
1741375618.323308 IP 10.0.1.3.9090 > 10.0.0.3.42624: Flags [.], ack 131585, win 1959, options [nop,nop,TS val 2446985497 ecr 4233006856], length 0
1741375618.323309 IP 10.0.1.3.9090 > 10.0.0.3.42624: Flags [.], ack 133033, win 1982, options [nop,nop,TS val 2446985497 ecr 4233006856], length 0
1741375618.323898 IP 10.0.1.3.9090 > 10.0.0.3.42624: Flags [.], ack 134481, win 2004, options [nop,nop,TS val 2446985498 ecr 4233006856], length 0
1741375618.323913 IP 10.0.1.3.9090 > 10.0.0.3.42624: Flags [.], ack 137377, win 2049, options [nop,nop,TS val 2446985498 ecr 4233006856], length 0
1741375618.323917 IP 10.0.1.3.9090 > 10.0.0.3.42624: Flags [.], ack 140273, win 2095, options [nop,nop,TS val 2446985498 ecr 4233006856], length 0
1741375618.323920 IP 10.0.1.3.9090 > 10.0.0.3.42624: Flags [.], ack 143169, win 2140, options [nop,nop,TS val 2446985498 ecr 4233006856], length 0
1741375618.323923 IP 10.0.1.3.9090 > 10.0.0.3.42624: Flags [.], ack 146065, win 2185, options [nop,nop,TS val 2446985498 ecr 4233006856], length 0
1741375618.323924 IP 10.0.1.3.9090 > 10.0.0.3.42624: Flags [.], ack 148961, win 2230, options [nop,nop,TS val 2446985498 ecr 4233006856], length 0
1741375618.323927 IP 10.0.1.3.9090 > 10.0.0.3.42624: Flags [.], ack 150001, win 2253, options [nop,nop,TS val 2446985498 ecr 4233006856], length 0
1741375618.356557 IP 10.0.0.3.42624 > 10.0.1.3.9090: Flags [.], seq 150001:151449, ack 1, win 502, options [nop,nop,TS val 4233006931 ecr 2446985498], length 1448
1741375618.356888 IP 10.0.0.3.42624 > 10.0.1.3.9090: Flags [.], seq 152897:154345, ack 1, win 502, options [nop,nop,TS val 4233006931 ecr 2446985498], length 1448
1741375618.357075 IP 10.0.0.3.42624 > 10.0.1.3.9090: Flags [.], seq 155793:157241, ack 1, win 502, options [nop,nop,TS val 4233006931 ecr 2446985498], length 1448
1741375618.357259 IP 10.0.0.3.42624 > 10.0.1.3.9090: Flags [.], seq 158689:160137, ack 1, win 502, options [nop,nop,TS val 4233006931 ecr 2446985498], length 1448
1741375618.357439 IP 10.0.0.3.42624 > 10.0.1.3.9090: Flags [.], seq 161585:163033, ack 1, win 502, options [nop,nop,TS val 4233006931 ecr 2446985498], length 1448
1741375618.357650 IP 10.0.0.3.42624 > 10.0.1.3.9090: Flags [.], seq 164481:165929, ack 1, win 502, options [nop,nop,TS val 4233006931 ecr 2446985498], length 1448
1741375618.357829 IP 10.0.0.3.42624 > 10.0.1.3.9090: Flags [.], seq 167377:168825, ack 1, win 502, options [nop,nop,TS val 4233006931 ecr 2446985498], length 1448
1741375618.357992 IP 10.0.0.3.42624 > 10.0.1.3.9090: Flags [.], seq 170273:171721, ack 1, win 502, options [nop,nop,TS val 4233006931 ecr 2446985498], length 1448
1741375618.358149 IP 10.0.0.3.42624 > 10.0.1.3.9090: Flags [.], seq 173169:174617, ack 1, win 502, options [nop,nop,TS val 4233006931 ecr 2446985498], length 1448
1741375618.358307 IP 10.0.0.3.42624 > 10.0.1.3.9090: Flags [.], seq 176065:177513, ack 1, win 502, options [nop,nop,TS val 4233006931 ecr 2446985498], length 1448
1741375618.403526 IP 10.0.1.3.9090 > 10.0.0.3.42624: Flags [.], ack 152897, win 2298, options [nop,nop,TS val 2446985574 ecr 4233006931], length 0
1741375618.403552 IP 10.0.1.3.9090 > 10.0.0.3.42624: Flags [.], ack 155793, win 2344, options [nop,nop,TS val 2446985574 ecr 4233006931], length 0
1741375618.403554 IP 10.0.1.3.9090 > 10.0.0.3.42624: Flags [.], ack 158689, win 2389, options [nop,nop,TS val 2446985574 ecr 4233006931], length 0
1741375618.403555 IP 10.0.1.3.9090 > 10.0.0.3.42624: Flags [.], ack 173169, win 2615, options [nop,nop,TS val 2446985574 ecr 4233006931], length 0
1741375618.403557 IP 10.0.1.3.9090 > 10.0.0.3.42624: Flags [.], ack 180001, win 2722, options [nop,nop,TS val 2446985574 ecr 4233006931], length 0
1741375618.432888 IP 10.0.0.3.42624 > 10.0.1.3.9090: Flags [.], seq 180001:181449, ack 1, win 502, options [nop,nop,TS val 4233007008 ecr 2446985574], length 1448
1741375618.433099 IP 10.0.0.3.42624 > 10.0.1.3.9090: Flags [.], seq 182897:184345, ack 1, win 502, options [nop,nop,TS val 4233007008 ecr 2446985574], length 1448
1741375618.433210 IP 10.0.0.3.42624 > 10.0.1.3.9090: Flags [.], seq 185793:187241, ack 1, win 502, options [nop,nop,TS val 4233007008 ecr 2446985574], length 1448
1741375618.433316 IP 10.0.0.3.42624 > 10.0.1.3.9090: Flags [.], seq 188689:190137, ack 1, win 502, options [nop,nop,TS val 4233007008 ecr 2446985574], length 1448
1741375618.433419 IP 10.0.0.3.42624 > 10.0.1.3.9090: Flags [.], seq 191585:193033, ack 1, win 502, options [nop,nop,TS val 4233007008 ecr 2446985574], length 1448
1741375618.433525 IP 10.0.0.3.42624 > 10.0.1.3.9090: Flags [.], seq 194481:195929, ack 1, win 502, options [nop,nop,TS val 4233007008 ecr 2446985574], length 1448
1741375618.433632 IP 10.0.0.3.42624 > 10.0.1.3.9090: Flags [.], seq 197377:198825, ack 1, win 502, options [nop,nop,TS val 4233007008 ecr 2446985574], length 1448
1741375618.433749 IP 10.0.0.3.42624 > 10.0.1.3.9090: Flags [.], seq 200273:201721, ack 1, win 502, options [nop,nop,TS val 4233007008 ecr 2446985574], length 1448
1741375618.433861 IP 10.0.0.3.42624 > 10.0.1.3.9090: Flags [.], seq 203169:204617, ack 1, win 502, options [nop,nop,TS val 4233007008 ecr 2446985574], length 1448
1741375618.433967 IP 10.0.0.3.42624 > 10.0.1.3.9090: Flags [.], seq 206065:207513, ack 1, win 502, options [nop,nop,TS val 4233007008 ecr 2446985574], length 1448
1741375618.474536 IP 10.0.1.3.9090 > 10.0.0.3.42624: Flags [.], ack 182897, win 2767, options [nop,nop,TS val 2446985648 ecr 4233007008], length 0
1741375618.474561 IP 10.0.1.3.9090 > 10.0.0.3.42624: Flags [.], ack 185793, win 2812, options [nop,nop,TS val 2446985648 ecr 4233007008], length 0
1741375618.474562 IP 10.0.1.3.9090 > 10.0.0.3.42624: Flags [.], ack 188689, win 2858, options [nop,nop,TS val 2446985648 ecr 4233007008], length 0
1741375618.474563 IP 10.0.1.3.9090 > 10.0.0.3.42624: Flags [.], ack 191585, win 2839, options [nop,nop,TS val 2446985648 ecr 4233007008], length 0
1741375618.474564 IP 10.0.1.3.9090 > 10.0.0.3.42624: Flags [.], ack 197377, win 2858, options [nop,nop,TS val 2446985648 ecr 4233007008], length 0
1741375618.474565 IP 10.0.1.3.9090 > 10.0.0.3.42624: Flags [.], ack 208961, win 2858, options [nop,nop,TS val 2446985649 ecr 4233007008], length 0
1741375618.474965 IP 10.0.1.3.9090 > 10.0.0.3.42624: Flags [.], ack 210001, win 2880, options [nop,nop,TS val 2446985649 ecr 4233007008], length 0
1741375618.507872 IP 10.0.0.3.42624 > 10.0.1.3.9090: Flags [.], seq 210001:211449, ack 1, win 502, options [nop,nop,TS val 4233007083 ecr 2446985649], length 1448
1741375618.508159 IP 10.0.0.3.42624 > 10.0.1.3.9090: Flags [.], seq 212897:214345, ack 1, win 502, options [nop,nop,TS val 4233007083 ecr 2446985649], length 1448
1741375618.508520 IP 10.0.0.3.42624 > 10.0.1.3.9090: Flags [.], seq 215793:217241, ack 1, win 502, options [nop,nop,TS val 4233007083 ecr 2446985649], length 1448
1741375618.508709 IP 10.0.0.3.42624 > 10.0.1.3.9090: Flags [.], seq 218689:220137, ack 1, win 502, options [nop,nop,TS val 4233007083 ecr 2446985649], length 1448
1741375618.508908 IP 10.0.0.3.42624 > 10.0.1.3.9090: Flags [.], seq 221585:223033, ack 1, win 502, options [nop,nop,TS val 4233007083 ecr 2446985649], length 1448
1741375618.509089 IP 10.0.0.3.42624 > 10.0.1.3.9090: Flags [.], seq 224481:225929, ack 1, win 502, options [nop,nop,TS val 4233007083 ecr 2446985649], length 1448
1741375618.509271 IP 10.0.0.3.42624 > 10.0.1.3.9090: Flags [.], seq 227377:228825, ack 1, win 502, options [nop,nop,TS val 4233007083 ecr 2446985649], length 1448
1741375618.509452 IP 10.0.0.3.42624 > 10.0.1.3.9090: Flags [.], seq 230273:231721, ack 1, win 502, options [nop,nop,TS val 4233007083 ecr 2446985649], length 1448
1741375618.509657 IP 10.0.0.3.42624 > 10.0.1.3.9090: Flags [.], seq 233169:234617, ack 1, win 502, options [nop,nop,TS val 4233007083 ecr 2446985649], length 1448
1741375618.509951 IP 10.0.0.3.42624 > 10.0.1.3.9090: Flags [.], seq 236065:237513, ack 1, win 502, options [nop,nop,TS val 4233007085 ecr 2446985649], length 1448
1741375618.550009 IP 10.0.1.3.9090 > 10.0.0.3.42624: Flags [.], ack 212897, win 2903, options [nop,nop,TS val 2446985724 ecr 4233007083], length 0
1741375618.550029 IP 10.0.1.3.9090 > 10.0.0.3.42624: Flags [.], ack 223033, win 2903, options [nop,nop,TS val 2446985724 ecr 4233007083], length 0
1741375618.552350 IP 10.0.1.3.9090 > 10.0.0.3.42624: Flags [.], ack 240001, win 2903, options [nop,nop,TS val 2446985726 ecr 4233007083], length 0
1741375618.582900 IP 10.0.0.3.42624 > 10.0.1.3.9090: Flags [.], seq 240001:241449, ack 1, win 502, options [nop,nop,TS val 4233007158 ecr 2446985726], length 1448
1741375618.583111 IP 10.0.0.3.42624 > 10.0.1.3.9090: Flags [.], seq 242897:244345, ack 1, win 502, options [nop,nop,TS val 4233007158 ecr 2446985726], length 1448
1741375618.583233 IP 10.0.0.3.42624 > 10.0.1.3.9090: Flags [.], seq 245793:247241, ack 1, win 502, options [nop,nop,TS val 4233007158 ecr 2446985726], length 1448
1741375618.583377 IP 10.0.0.3.42624 > 10.0.1.3.9090: Flags [.], seq 248689:250137, ack 1, win 502, options [nop,nop,TS val 4233007158 ecr 2446985726], length 1448
1741375618.583487 IP 10.0.0.3.42624 > 10.0.1.3.9090: Flags [.], seq 251585:253033, ack 1, win 502, options [nop,nop,TS val 4233007158 ecr 2446985726], length 1448
1741375618.583601 IP 10.0.0.3.42624 > 10.0.1.3.9090: Flags [.], seq 254481:255929, ack 1, win 502, options [nop,nop,TS val 4233007158 ecr 2446985726], length 1448
1741375618.583713 IP 10.0.0.3.42624 > 10.0.1.3.9090: Flags [.], seq 257377:258825, ack 1, win 502, options [nop,nop,TS val 4233007158 ecr 2446985726], length 1448
1741375618.583840 IP 10.0.0.3.42624 > 10.0.1.3.9090: Flags [.], seq 260273:261721, ack 1, win 502, options [nop,nop,TS val 4233007158 ecr 2446985726], length 1448
1741375618.583953 IP 10.0.0.3.42624 > 10.0.1.3.9090: Flags [.], seq 263169:264617, ack 1, win 502, options [nop,nop,TS val 4233007158 ecr 2446985726], length 1448
1741375618.584074 IP 10.0.0.3.42624 > 10.0.1.3.9090: Flags [.], seq 266065:267513, ack 1, win 502, options [nop,nop,TS val 4233007158 ecr 2446985726], length 1448
1741375618.624709 IP 10.0.1.3.9090 > 10.0.0.3.42624: Flags [.], ack 242897, win 2903, options [nop,nop,TS val 2446985798 ecr 4233007158], length 0
1741375618.624730 IP 10.0.1.3.9090 > 10.0.0.3.42624: Flags [.], ack 263169, win 2903, options [nop,nop,TS val 2446985799 ecr 4233007158], length 0
1741375618.625324 IP 10.0.1.3.9090 > 10.0.0.3.42624: Flags [.], ack 266065, win 2903, options [nop,nop,TS val 2446985799 ecr 4233007158], length 0
1741375618.629006 IP 10.0.1.3.9090 > 10.0.0.3.42624: Flags [.], ack 270001, win 2903, options [nop,nop,TS val 2446985803 ecr 4233007158], length 0
1741375618.657338 IP 10.0.0.3.42624 > 10.0.1.3.9090: Flags [.], seq 270001:271449, ack 1, win 502, options [nop,nop,TS val 4233007232 ecr 2446985803], length 1448
1741375618.657556 IP 10.0.0.3.42624 > 10.0.1.3.9090: Flags [.], seq 272897:274345, ack 1, win 502, options [nop,nop,TS val 4233007232 ecr 2446985803], length 1448
1741375618.657665 IP 10.0.0.3.42624 > 10.0.1.3.9090: Flags [.], seq 275793:277241, ack 1, win 502, options [nop,nop,TS val 4233007232 ecr 2446985803], length 1448
1741375618.657778 IP 10.0.0.3.42624 > 10.0.1.3.9090: Flags [.], seq 278689:280137, ack 1, win 502, options [nop,nop,TS val 4233007232 ecr 2446985803], length 1448
1741375618.657942 IP 10.0.0.3.42624 > 10.0.1.3.9090: Flags [.], seq 281585:283033, ack 1, win 502, options [nop,nop,TS val 4233007232 ecr 2446985803], length 1448
1741375618.658050 IP 10.0.0.3.42624 > 10.0.1.3.9090: Flags [.], seq 284481:285929, ack 1, win 502, options [nop,nop,TS val 4233007232 ecr 2446985803], length 1448
1741375618.658157 IP 10.0.0.3.42624 > 10.0.1.3.9090: Flags [.], seq 287377:288825, ack 1, win 502, options [nop,nop,TS val 4233007232 ecr 2446985803], length 1448
1741375618.658264 IP 10.0.0.3.42624 > 10.0.1.3.9090: Flags [.], seq 290273:291721, ack 1, win 502, options [nop,nop,TS val 4233007232 ecr 2446985803], length 1448
1741375618.658372 IP 10.0.0.3.42624 > 10.0.1.3.9090: Flags [.], seq 293169:294617, ack 1, win 502, options [nop,nop,TS val 4233007232 ecr 2446985803], length 1448
1741375618.658479 IP 10.0.0.3.42624 > 10.0.1.3.9090: Flags [.], seq 296065:297513, ack 1, win 502, options [nop,nop,TS val 4233007232 ecr 2446985803], length 1448
1741375618.699370 IP 10.0.1.3.9090 > 10.0.0.3.42624: Flags [.], ack 272897, win 2903, options [nop,nop,TS val 2446985873 ecr 4233007232], length 0
1741375618.699390 IP 10.0.1.3.9090 > 10.0.0.3.42624: Flags [.], ack 293169, win 2903, options [nop,nop,TS val 2446985873 ecr 4233007232], length 0
1741375618.699393 IP 10.0.1.3.9090 > 10.0.0.3.42624: Flags [.], ack 296065, win 2903, options [nop,nop,TS val 2446985873 ecr 4233007232], length 0
1741375618.701986 IP 10.0.1.3.9090 > 10.0.0.3.42624: Flags [.], ack 300001, win 2903, options [nop,nop,TS val 2446985876 ecr 4233007232], length 0
1741375618.731225 IP 10.0.0.3.42624 > 10.0.1.3.9090: Flags [.], seq 300001:301449, ack 1, win 502, options [nop,nop,TS val 4233007306 ecr 2446985876], length 1448
1741375618.731425 IP 10.0.0.3.42624 > 10.0.1.3.9090: Flags [.], seq 302897:304345, ack 1, win 502, options [nop,nop,TS val 4233007306 ecr 2446985876], length 1448
1741375618.731534 IP 10.0.0.3.42624 > 10.0.1.3.9090: Flags [.], seq 305793:307241, ack 1, win 502, options [nop,nop,TS val 4233007306 ecr 2446985876], length 1448
1741375618.731641 IP 10.0.0.3.42624 > 10.0.1.3.9090: Flags [.], seq 308689:310137, ack 1, win 502, options [nop,nop,TS val 4233007306 ecr 2446985876], length 1448
1741375618.731748 IP 10.0.0.3.42624 > 10.0.1.3.9090: Flags [.], seq 311585:313033, ack 1, win 502, options [nop,nop,TS val 4233007306 ecr 2446985876], length 1448
1741375618.731902 IP 10.0.0.3.42624 > 10.0.1.3.9090: Flags [.], seq 314481:315929, ack 1, win 502, options [nop,nop,TS val 4233007306 ecr 2446985876], length 1448
1741375618.732008 IP 10.0.0.3.42624 > 10.0.1.3.9090: Flags [.], seq 317377:318825, ack 1, win 502, options [nop,nop,TS val 4233007306 ecr 2446985876], length 1448
1741375618.732112 IP 10.0.0.3.42624 > 10.0.1.3.9090: Flags [.], seq 320273:321721, ack 1, win 502, options [nop,nop,TS val 4233007306 ecr 2446985876], length 1448
1741375618.732218 IP 10.0.0.3.42624 > 10.0.1.3.9090: Flags [.], seq 323169:324617, ack 1, win 502, options [nop,nop,TS val 4233007306 ecr 2446985876], length 1448
1741375618.732323 IP 10.0.0.3.42624 > 10.0.1.3.9090: Flags [.], seq 326065:327513, ack 1, win 502, options [nop,nop,TS val 4233007306 ecr 2446985876], length 1448
1741375618.773066 IP 10.0.1.3.9090 > 10.0.0.3.42624: Flags [.], ack 302897, win 2903, options [nop,nop,TS val 2446985947 ecr 4233007306], length 0
1741375618.773088 IP 10.0.1.3.9090 > 10.0.0.3.42624: Flags [.], ack 323169, win 2903, options [nop,nop,TS val 2446985947 ecr 4233007306], length 0
1741375618.773149 IP 10.0.1.3.9090 > 10.0.0.3.42624: Flags [.], ack 326065, win 2903, options [nop,nop,TS val 2446985947 ecr 4233007306], length 0
1741375618.775999 IP 10.0.1.3.9090 > 10.0.0.3.42624: Flags [.], ack 330001, win 2903, options [nop,nop,TS val 2446985950 ecr 4233007306], length 0
1741375618.804817 IP 10.0.0.3.42624 > 10.0.1.3.9090: Flags [.], seq 330001:331449, ack 1, win 502, options [nop,nop,TS val 4233007380 ecr 2446985950], length 1448
1741375618.805062 IP 10.0.0.3.42624 > 10.0.1.3.9090: Flags [.], seq 332897:334345, ack 1, win 502, options [nop,nop,TS val 4233007380 ecr 2446985950], length 1448
1741375618.805213 IP 10.0.0.3.42624 > 10.0.1.3.9090: Flags [.], seq 335793:337241, ack 1, win 502, options [nop,nop,TS val 4233007380 ecr 2446985950], length 1448
1741375618.805357 IP 10.0.0.3.42624 > 10.0.1.3.9090: Flags [.], seq 338689:340137, ack 1, win 502, options [nop,nop,TS val 4233007380 ecr 2446985950], length 1448
1741375618.805494 IP 10.0.0.3.42624 > 10.0.1.3.9090: Flags [.], seq 341585:343033, ack 1, win 502, options [nop,nop,TS val 4233007380 ecr 2446985950], length 1448
1741375618.805675 IP 10.0.0.3.42624 > 10.0.1.3.9090: Flags [.], seq 344481:345929, ack 1, win 502, options [nop,nop,TS val 4233007380 ecr 2446985950], length 1448
1741375618.805822 IP 10.0.0.3.42624 > 10.0.1.3.9090: Flags [.], seq 347377:348825, ack 1, win 502, options [nop,nop,TS val 4233007380 ecr 2446985950], length 1448
1741375618.806033 IP 10.0.0.3.42624 > 10.0.1.3.9090: Flags [.], seq 350273:351721, ack 1, win 502, options [nop,nop,TS val 4233007380 ecr 2446985950], length 1448
1741375618.806196 IP 10.0.0.3.42624 > 10.0.1.3.9090: Flags [.], seq 353169:354617, ack 1, win 502, options [nop,nop,TS val 4233007380 ecr 2446985950], length 1448
1741375618.806742 IP 10.0.0.3.42624 > 10.0.1.3.9090: Flags [.], seq 356065:357513, ack 1, win 502, options [nop,nop,TS val 4233007381 ecr 2446985950], length 1448
1741375618.846676 IP 10.0.1.3.9090 > 10.0.0.3.42624: Flags [.], ack 332897, win 2903, options [nop,nop,TS val 2446986020 ecr 4233007380], length 0
1741375618.846695 IP 10.0.1.3.9090 > 10.0.0.3.42624: Flags [.], ack 338689, win 2903, options [nop,nop,TS val 2446986020 ecr 4233007380], length 0
1741375618.848801 IP 10.0.1.3.9090 > 10.0.0.3.42624: Flags [.], ack 360001, win 2903, options [nop,nop,TS val 2446986023 ecr 4233007380], length 0
1741375618.879802 IP 10.0.0.3.42624 > 10.0.1.3.9090: Flags [.], seq 360001:361449, ack 1, win 502, options [nop,nop,TS val 4233007455 ecr 2446986023], length 1448
1741375618.880017 IP 10.0.0.3.42624 > 10.0.1.3.9090: Flags [.], seq 362897:364345, ack 1, win 502, options [nop,nop,TS val 4233007455 ecr 2446986023], length 1448
1741375618.880124 IP 10.0.0.3.42624 > 10.0.1.3.9090: Flags [.], seq 365793:367241, ack 1, win 502, options [nop,nop,TS val 4233007455 ecr 2446986023], length 1448
1741375618.880231 IP 10.0.0.3.42624 > 10.0.1.3.9090: Flags [.], seq 368689:370137, ack 1, win 502, options [nop,nop,TS val 4233007455 ecr 2446986023], length 1448
1741375618.880343 IP 10.0.0.3.42624 > 10.0.1.3.9090: Flags [.], seq 371585:373033, ack 1, win 502, options [nop,nop,TS val 4233007455 ecr 2446986023], length 1448
1741375618.880451 IP 10.0.0.3.42624 > 10.0.1.3.9090: Flags [.], seq 374481:375929, ack 1, win 502, options [nop,nop,TS val 4233007455 ecr 2446986023], length 1448
1741375618.880593 IP 10.0.0.3.42624 > 10.0.1.3.9090: Flags [.], seq 377377:378825, ack 1, win 502, options [nop,nop,TS val 4233007455 ecr 2446986023], length 1448
1741375618.880730 IP 10.0.0.3.42624 > 10.0.1.3.9090: Flags [.], seq 380273:381721, ack 1, win 502, options [nop,nop,TS val 4233007455 ecr 2446986023], length 1448
1741375618.880864 IP 10.0.0.3.42624 > 10.0.1.3.9090: Flags [.], seq 383169:384617, ack 1, win 502, options [nop,nop,TS val 4233007455 ecr 2446986023], length 1448
1741375618.880973 IP 10.0.0.3.42624 > 10.0.1.3.9090: Flags [.], seq 386065:387513, ack 1, win 502, options [nop,nop,TS val 4233007455 ecr 2446986023], length 1448
1741375618.921380 IP 10.0.1.3.9090 > 10.0.0.3.42624: Flags [.], ack 362897, win 2903, options [nop,nop,TS val 2446986095 ecr 4233007455], length 0
1741375618.921403 IP 10.0.1.3.9090 > 10.0.0.3.42624: Flags [.], ack 368689, win 2903, options [nop,nop,TS val 2446986095 ecr 4233007455], length 0
1741375618.923810 IP 10.0.1.3.9090 > 10.0.0.3.42624: Flags [.], ack 390001, win 2903, options [nop,nop,TS val 2446986098 ecr 4233007455], length 0
1741375618.953856 IP 10.0.0.3.42624 > 10.0.1.3.9090: Flags [.], seq 390001:391449, ack 1, win 502, options [nop,nop,TS val 4233007529 ecr 2446986098], length 1448
1741375618.954059 IP 10.0.0.3.42624 > 10.0.1.3.9090: Flags [.], seq 392897:394345, ack 1, win 502, options [nop,nop,TS val 4233007529 ecr 2446986098], length 1448
1741375618.954208 IP 10.0.0.3.42624 > 10.0.1.3.9090: Flags [.], seq 395793:397241, ack 1, win 502, options [nop,nop,TS val 4233007529 ecr 2446986098], length 1448
1741375618.954322 IP 10.0.0.3.42624 > 10.0.1.3.9090: Flags [.], seq 398689:400137, ack 1, win 502, options [nop,nop,TS val 4233007529 ecr 2446986098], length 1448
1741375618.954426 IP 10.0.0.3.42624 > 10.0.1.3.9090: Flags [.], seq 401585:403033, ack 1, win 502, options [nop,nop,TS val 4233007529 ecr 2446986098], length 1448
1741375618.954532 IP 10.0.0.3.42624 > 10.0.1.3.9090: Flags [.], seq 404481:405929, ack 1, win 502, options [nop,nop,TS val 4233007529 ecr 2446986098], length 1448
1741375618.954636 IP 10.0.0.3.42624 > 10.0.1.3.9090: Flags [.], seq 407377:408825, ack 1, win 502, options [nop,nop,TS val 4233007529 ecr 2446986098], length 1448
1741375618.954737 IP 10.0.0.3.42624 > 10.0.1.3.9090: Flags [.], seq 410273:411721, ack 1, win 502, options [nop,nop,TS val 4233007529 ecr 2446986098], length 1448
1741375618.954876 IP 10.0.0.3.42624 > 10.0.1.3.9090: Flags [.], seq 413169:414617, ack 1, win 502, options [nop,nop,TS val 4233007529 ecr 2446986098], length 1448
1741375618.954987 IP 10.0.0.3.42624 > 10.0.1.3.9090: Flags [.], seq 416065:417513, ack 1, win 502, options [nop,nop,TS val 4233007529 ecr 2446986098], length 1448
1741375618.995604 IP 10.0.1.3.9090 > 10.0.0.3.42624: Flags [.], ack 392897, win 2903, options [nop,nop,TS val 2446986169 ecr 4233007529], length 0
1741375618.995627 IP 10.0.1.3.9090 > 10.0.0.3.42624: Flags [.], ack 398689, win 2903, options [nop,nop,TS val 2446986170 ecr 4233007529], length 0
1741375618.998791 IP 10.0.1.3.9090 > 10.0.0.3.42624: Flags [.], ack 420001, win 2903, options [nop,nop,TS val 2446986173 ecr 4233007529], length 0
1741375619.029869 IP 10.0.0.3.42624 > 10.0.1.3.9090: Flags [.], seq 420001:421449, ack 1, win 502, options [nop,nop,TS val 4233007605 ecr 2446986173], length 1448
1741375619.030185 IP 10.0.0.3.42624 > 10.0.1.3.9090: Flags [.], seq 422897:424345, ack 1, win 502, options [nop,nop,TS val 4233007605 ecr 2446986173], length 1448
1741375619.030353 IP 10.0.0.3.42624 > 10.0.1.3.9090: Flags [.], seq 425793:427241, ack 1, win 502, options [nop,nop,TS val 4233007605 ecr 2446986173], length 1448
1741375619.030479 IP 10.0.0.3.42624 > 10.0.1.3.9090: Flags [.], seq 428689:430137, ack 1, win 502, options [nop,nop,TS val 4233007605 ecr 2446986173], length 1448
1741375619.030598 IP 10.0.0.3.42624 > 10.0.1.3.9090: Flags [.], seq 431585:433033, ack 1, win 502, options [nop,nop,TS val 4233007605 ecr 2446986173], length 1448
1741375619.030716 IP 10.0.0.3.42624 > 10.0.1.3.9090: Flags [.], seq 434481:435929, ack 1, win 502, options [nop,nop,TS val 4233007605 ecr 2446986173], length 1448
1741375619.030847 IP 10.0.0.3.42624 > 10.0.1.3.9090: Flags [.], seq 437377:438825, ack 1, win 502, options [nop,nop,TS val 4233007605 ecr 2446986173], length 1448
1741375619.030964 IP 10.0.0.3.42624 > 10.0.1.3.9090: Flags [.], seq 440273:441721, ack 1, win 502, options [nop,nop,TS val 4233007605 ecr 2446986173], length 1448
1741375619.031107 IP 10.0.0.3.42624 > 10.0.1.3.9090: Flags [.], seq 443169:444617, ack 1, win 502, options [nop,nop,TS val 4233007605 ecr 2446986173], length 1448
1741375619.031229 IP 10.0.0.3.42624 > 10.0.1.3.9090: Flags [.], seq 446065:447513, ack 1, win 502, options [nop,nop,TS val 4233007605 ecr 2446986173], length 1448
1741375619.071326 IP 10.0.1.3.9090 > 10.0.0.3.42624: Flags [.], ack 422897, win 2903, options [nop,nop,TS val 2446986245 ecr 4233007605], length 0
1741375619.071345 IP 10.0.1.3.9090 > 10.0.0.3.42624: Flags [.], ack 430137, win 2903, options [nop,nop,TS val 2446986245 ecr 4233007605], length 0
1741375619.072782 IP 10.0.1.3.9090 > 10.0.0.3.42624: Flags [.], ack 431585, win 2914, options [nop,nop,TS val 2446986247 ecr 4233007605], length 0
1741375619.072794 IP 10.0.1.3.9090 > 10.0.0.3.42624: Flags [.], ack 443169, win 2914, options [nop,nop,TS val 2446986247 ecr 4233007605], length 0
1741375619.075910 IP 10.0.1.3.9090 > 10.0.0.3.42624: Flags [.], ack 450001, win 2914, options [nop,nop,TS val 2446986250 ecr 4233007605], length 0
1741375619.104349 IP 10.0.0.3.42624 > 10.0.1.3.9090: Flags [.], seq 450001:451449, ack 1, win 502, options [nop,nop,TS val 4233007679 ecr 2446986250], length 1448
1741375619.104551 IP 10.0.0.3.42624 > 10.0.1.3.9090: Flags [.], seq 452897:454345, ack 1, win 502, options [nop,nop,TS val 4233007679 ecr 2446986250], length 1448
1741375619.104708 IP 10.0.0.3.42624 > 10.0.1.3.9090: Flags [.], seq 455793:457241, ack 1, win 502, options [nop,nop,TS val 4233007679 ecr 2446986250], length 1448
1741375619.104853 IP 10.0.0.3.42624 > 10.0.1.3.9090: Flags [.], seq 458689:460137, ack 1, win 502, options [nop,nop,TS val 4233007679 ecr 2446986250], length 1448
1741375619.104967 IP 10.0.0.3.42624 > 10.0.1.3.9090: Flags [.], seq 461585:463033, ack 1, win 502, options [nop,nop,TS val 4233007679 ecr 2446986250], length 1448
1741375619.105074 IP 10.0.0.3.42624 > 10.0.1.3.9090: Flags [.], seq 464481:465929, ack 1, win 502, options [nop,nop,TS val 4233007679 ecr 2446986250], length 1448
